
T:  Bus=03 Lev=00 Prnt=00 Port=00 Cnt=00 Dev#=  1 Spd=12   MxCh= 2
B:  Alloc= 26/900 us ( 3%), #Int=  2, #Iso=  0
D:  Ver= 1.10 Cls=09(hub  ) Sub=00 Prot=00 MxPS=64 #Cfgs=  1
P:  Vendor=1d6b ProdID=0001 Rev= 3.19
S:  Manufacturer=Linux 3.19.0-0.rc3.git0.1.fc22.ppc64 ohci_hcd
S:  Product=OHCI PCI host controller
S:  SerialNumber=0001:01:0b.1
C:* #Ifs= 1 Cfg#= 1 Atr=e0 MxPwr=  0mA
I:* If#= 0 Alt= 0 #EPs= 1 Cls=09(hub  ) Sub=00 Prot=00 Driver=hub
E:  Ad=81(I) Atr=03(Int.) MxPS=   2 Ivl=255ms

T:  Bus=03 Lev=01 Prnt=01 Port=01 Cnt=01 Dev#=  2 Spd=1.5  MxCh= 0
D:  Ver= 1.10 Cls=00(>ifc ) Sub=00 Prot=00 MxPS= 8 #Cfgs=  1
P:  Vendor=0624 ProdID=0296 Rev= 1.00
S:  Manufacturer=Avocent
S:  Product=IBM 73P5832
C:* #Ifs= 2 Cfg#= 1 Atr=a0 MxPwr=100mA
I:* If#= 0 Alt= 0 #EPs= 1 Cls=03(HID  ) Sub=01 Prot=01 Driver=usbhid
E:  Ad=81(I) Atr=03(Int.) MxPS=   8 Ivl=10ms
I:* If#= 1 Alt= 0 #EPs= 1 Cls=03(HID  ) Sub=01 Prot=02 Driver=usbhid
E:  Ad=82(I) Atr=03(Int.) MxPS=   5 Ivl=10ms

T:  Bus=02 Lev=00 Prnt=00 Port=00 Cnt=00 Dev#=  1 Spd=12   MxCh= 3
B:  Alloc= 26/900 us ( 3%), #Int=  2, #Iso=  0
D:  Ver= 1.10 Cls=09(hub  ) Sub=00 Prot=00 MxPS=64 #Cfgs=  1
P:  Vendor=1d6b ProdID=0001 Rev= 3.19
S:  Manufacturer=Linux 3.19.0-0.rc3.git0.1.fc22.ppc64 ohci_hcd
S:  Product=OHCI PCI host controller
S:  SerialNumber=0001:01:0b.0
C:* #Ifs= 1 Cfg#= 1 Atr=e0 MxPwr=  0mA
I:* If#= 0 Alt= 0 #EPs= 1 Cls=09(hub  ) Sub=00 Prot=00 Driver=hub
E:  Ad=81(I) Atr=03(Int.) MxPS=   2 Ivl=255ms

T:  Bus=02 Lev=01 Prnt=01 Port=01 Cnt=01 Dev#=  2 Spd=1.5  MxCh= 0
D:  Ver= 1.10 Cls=00(>ifc ) Sub=00 Prot=00 MxPS= 8 #Cfgs=  1
P:  Vendor=0624 ProdID=0296 Rev= 1.00
S:  Manufacturer=Avocent
S:  Product=IBM 73P5832
C:* #Ifs= 2 Cfg#= 1 Atr=a0 MxPwr=100mA
I:* If#= 0 Alt= 0 #EPs= 1 Cls=03(HID  ) Sub=01 Prot=01 Driver=usbhid
E:  Ad=81(I) Atr=03(Int.) MxPS=   8 Ivl=10ms
I:* If#= 1 Alt= 0 #EPs= 1 Cls=03(HID  ) Sub=01 Prot=02 Driver=usbhid
E:  Ad=82(I) Atr=03(Int.) MxPS=   5 Ivl=10ms

T:  Bus=01 Lev=00 Prnt=00 Port=00 Cnt=00 Dev#=  1 Spd=480  MxCh= 5
B:  Alloc=  0/800 us ( 0%), #Int=  0, #Iso=  0
D:  Ver= 2.00 Cls=09(hub  ) Sub=00 Prot=00 MxPS=64 #Cfgs=  1
P:  Vendor=1d6b ProdID=0002 Rev= 3.19
S:  Manufacturer=Linux 3.19.0-0.rc3.git0.1.fc22.ppc64 ehci_hcd
S:  Product=EHCI Host Controller
S:  SerialNumber=0001:01:0b.2
C:* #Ifs= 1 Cfg#= 1 Atr=e0 MxPwr=  0mA
I:* If#= 0 Alt= 0 #EPs= 1 Cls=09(hub  ) Sub=00 Prot=00 Driver=hub
E:  Ad=81(I) Atr=03(Int.) MxPS=   4 Ivl=256ms
