
T:  Bus=02 Lev=00 Prnt=00 Port=00 Cnt=00 Dev#=  1 Spd=12   MxCh= 5
B:  Alloc= 14/900 us ( 2%), #Int=  1, #Iso=  0
D:  Ver= 1.10 Cls=09(hub  ) Sub=00 Prot=00 MxPS=64 #Cfgs=  1
P:  Vendor=1d6b ProdID=0001 Rev= 2.06
S:  Manufacturer=Linux 2.6.32-573.el6.x86_64 ohci_hcd
S:  Product=OHCI Host Controller
S:  SerialNumber=0000:00:02.0
C:* #Ifs= 1 Cfg#= 1 Atr=e0 MxPwr=  0mA
I:* If#= 0 Alt= 0 #EPs= 1 Cls=09(hub  ) Sub=00 Prot=00 Driver=hub
E:  Ad=81(I) Atr=03(Int.) MxPS=   2 Ivl=255ms

T:  Bus=02 Lev=01 Prnt=01 Port=00 Cnt=01 Dev#=  2 Spd=1.5  MxCh= 0
D:  Ver= 1.10 Cls=00(>ifc ) Sub=00 Prot=00 MxPS= 8 #Cfgs=  1
P:  Vendor=046b ProdID=ff10 Rev= 1.00
S:  Manufacturer=American Megatrends Inc.
S:  Product=Virtual Keyboard and Mouse
C:* #Ifs= 2 Cfg#= 1 Atr=c0 MxPwr=  0mA
I:* If#= 0 Alt= 0 #EPs= 1 Cls=03(HID  ) Sub=01 Prot=01 Driver=usbhid
E:  Ad=81(I) Atr=03(Int.) MxPS=   8 Ivl=10ms
I:* If#= 1 Alt= 0 #EPs= 1 Cls=03(HID  ) Sub=01 Prot=02 Driver=usbhid
E:  Ad=82(I) Atr=03(Int.) MxPS=   8 Ivl=10ms

T:  Bus=01 Lev=00 Prnt=00 Port=00 Cnt=00 Dev#=  1 Spd=480  MxCh= 5
B:  Alloc=  0/800 us ( 0%), #Int=  0, #Iso=  0
D:  Ver= 2.00 Cls=09(hub  ) Sub=00 Prot=00 MxPS=64 #Cfgs=  1
P:  Vendor=1d6b ProdID=0002 Rev= 2.06
S:  Manufacturer=Linux 2.6.32-573.el6.x86_64 ehci_hcd
S:  Product=EHCI Host Controller
S:  SerialNumber=0000:00:02.1
C:* #Ifs= 1 Cfg#= 1 Atr=e0 MxPwr=  0mA
I:* If#= 0 Alt= 0 #EPs= 1 Cls=09(hub  ) Sub=00 Prot=00 Driver=hub
E:  Ad=81(I) Atr=03(Int.) MxPS=   4 Ivl=256ms

T:  Bus=01 Lev=01 Prnt=01 Port=01 Cnt=01 Dev#=  3 Spd=480  MxCh= 0
D:  Ver= 2.00 Cls=00(>ifc ) Sub=00 Prot=00 MxPS=64 #Cfgs=  1
P:  Vendor=046b ProdID=ff20 Rev= 1.00
S:  Manufacturer=American Megatrends Inc.
S:  Product=Virtual Cdrom Device
C:* #Ifs= 1 Cfg#= 1 Atr=c0 MxPwr=  0mA
I:* If#= 0 Alt= 0 #EPs= 2 Cls=08(stor.) Sub=05 Prot=50 Driver=usb-storage
E:  Ad=01(O) Atr=02(Bulk) MxPS= 512 Ivl=0ms
E:  Ad=82(I) Atr=02(Bulk) MxPS= 512 Ivl=0ms

T:  Bus=01 Lev=01 Prnt=01 Port=04 Cnt=02 Dev#=  4 Spd=480  MxCh= 0
D:  Ver= 2.00 Cls=00(>ifc ) Sub=00 Prot=00 MxPS=64 #Cfgs=  1
P:  Vendor=046b ProdID=ff42 Rev= 1.00
S:  Manufacturer=American Megatrends Inc.
S:  Product=Virtual Floppy Device
C:* #Ifs= 1 Cfg#= 1 Atr=c0 MxPwr=  0mA
I:* If#= 0 Alt= 0 #EPs= 2 Cls=08(stor.) Sub=04 Prot=50 Driver=usb-storage
E:  Ad=01(O) Atr=02(Bulk) MxPS= 512 Ivl=0ms
E:  Ad=82(I) Atr=02(Bulk) MxPS= 512 Ivl=0ms
