
T:  Bus=04 Lev=00 Prnt=00 Port=00 Cnt=00 Dev#=  1 Spd=12   MxCh= 2
B:  Alloc=  0/900 us ( 0%), #Int=  0, #Iso=  0
D:  Ver= 1.10 Cls=09(hub  ) Sub=00 Prot=00 MxPS=64 #Cfgs=  1
P:  Vendor=1d6b ProdID=0001 Rev= 2.06
S:  Manufacturer=Linux 2.6.32-504.el6.x86_64 uhci_hcd
S:  Product=UHCI Host Controller
S:  SerialNumber=0000:00:1d.2
C:* #Ifs= 1 Cfg#= 1 Atr=e0 MxPwr=  0mA
I:* If#= 0 Alt= 0 #EPs= 1 Cls=09(hub  ) Sub=00 Prot=00 Driver=hub
E:  Ad=81(I) Atr=03(Int.) MxPS=   2 Ivl=255ms

T:  Bus=03 Lev=00 Prnt=00 Port=00 Cnt=00 Dev#=  1 Spd=12   MxCh= 2
B:  Alloc=  0/900 us ( 0%), #Int=  0, #Iso=  0
D:  Ver= 1.10 Cls=09(hub  ) Sub=00 Prot=00 MxPS=64 #Cfgs=  1
P:  Vendor=1d6b ProdID=0001 Rev= 2.06
S:  Manufacturer=Linux 2.6.32-504.el6.x86_64 uhci_hcd
S:  Product=UHCI Host Controller
S:  SerialNumber=0000:00:1d.1
C:* #Ifs= 1 Cfg#= 1 Atr=e0 MxPwr=  0mA
I:* If#= 0 Alt= 0 #EPs= 1 Cls=09(hub  ) Sub=00 Prot=00 Driver=hub
E:  Ad=81(I) Atr=03(Int.) MxPS=   2 Ivl=255ms

T:  Bus=02 Lev=00 Prnt=00 Port=00 Cnt=00 Dev#=  1 Spd=12   MxCh= 2
B:  Alloc=  0/900 us ( 0%), #Int=  0, #Iso=  0
D:  Ver= 1.10 Cls=09(hub  ) Sub=00 Prot=00 MxPS=64 #Cfgs=  1
P:  Vendor=1d6b ProdID=0001 Rev= 2.06
S:  Manufacturer=Linux 2.6.32-504.el6.x86_64 uhci_hcd
S:  Product=UHCI Host Controller
S:  SerialNumber=0000:00:1d.0
C:* #Ifs= 1 Cfg#= 1 Atr=e0 MxPwr=  0mA
I:* If#= 0 Alt= 0 #EPs= 1 Cls=09(hub  ) Sub=00 Prot=00 Driver=hub
E:  Ad=81(I) Atr=03(Int.) MxPS=   2 Ivl=255ms

T:  Bus=01 Lev=00 Prnt=00 Port=00 Cnt=00 Dev#=  1 Spd=480  MxCh= 6
B:  Alloc=  0/800 us ( 0%), #Int=  3, #Iso=  0
D:  Ver= 2.00 Cls=09(hub  ) Sub=00 Prot=00 MxPS=64 #Cfgs=  1
P:  Vendor=1d6b ProdID=0002 Rev= 2.06
S:  Manufacturer=Linux 2.6.32-504.el6.x86_64 ehci_hcd
S:  Product=EHCI Host Controller
S:  SerialNumber=0000:00:1d.7
C:* #Ifs= 1 Cfg#= 1 Atr=e0 MxPwr=  0mA
I:* If#= 0 Alt= 0 #EPs= 1 Cls=09(hub  ) Sub=00 Prot=00 Driver=hub
E:  Ad=81(I) Atr=03(Int.) MxPS=   4 Ivl=256ms

T:  Bus=01 Lev=01 Prnt=01 Port=00 Cnt=01 Dev#=  2 Spd=480  MxCh= 2
D:  Ver= 2.00 Cls=09(hub  ) Sub=00 Prot=02 MxPS=64 #Cfgs=  1
P:  Vendor=413c ProdID=a001 Rev= 0.00
C:* #Ifs= 1 Cfg#= 1 Atr=e0 MxPwr=100mA
I:  If#= 0 Alt= 0 #EPs= 1 Cls=09(hub  ) Sub=00 Prot=01 Driver=hub
E:  Ad=81(I) Atr=03(Int.) MxPS=   1 Ivl=256ms
I:* If#= 0 Alt= 1 #EPs= 1 Cls=09(hub  ) Sub=00 Prot=02 Driver=hub
E:  Ad=81(I) Atr=03(Int.) MxPS=   1 Ivl=256ms

T:  Bus=01 Lev=02 Prnt=02 Port=00 Cnt=01 Dev#=  4 Spd=12   MxCh= 0
D:  Ver= 1.10 Cls=00(>ifc ) Sub=00 Prot=00 MxPS=64 #Cfgs=  1
P:  Vendor=413c ProdID=0000 Rev= 0.00
S:  Manufacturer=Dell
S:  Product=DRAC5
S:  SerialNumber=0000000
C:* #Ifs= 2 Cfg#= 1 Atr=c0 MxPwr=  0mA
I:* If#= 0 Alt= 0 #EPs= 1 Cls=03(HID  ) Sub=01 Prot=01 Driver=usbhid
E:  Ad=81(I) Atr=03(Int.) MxPS=   8 Ivl=16ms
I:* If#= 1 Alt= 0 #EPs= 1 Cls=03(HID  ) Sub=01 Prot=02 Driver=usbhid
E:  Ad=82(I) Atr=03(Int.) MxPS=   6 Ivl=8ms

T:  Bus=01 Lev=02 Prnt=02 Port=01 Cnt=02 Dev#=  5 Spd=480  MxCh= 0
D:  Ver= 2.00 Cls=00(>ifc ) Sub=00 Prot=00 MxPS=64 #Cfgs=  1
P:  Vendor=413c ProdID=0001 Rev= 0.00
S:  Manufacturer=DELL  INC.                 
S:  Product=DRAC5 VIRTUAL  MEDIA   
S:  SerialNumber=1028  123456
C:* #Ifs= 3 Cfg#= 1 Atr=c0 MxPwr=  0mA
I:* If#= 0 Alt= 0 #EPs= 2 Cls=08(stor.) Sub=06 Prot=50 Driver=usb-storage
E:  Ad=81(I) Atr=02(Bulk) MxPS= 512 Ivl=0ms
E:  Ad=01(O) Atr=02(Bulk) MxPS= 512 Ivl=0ms
I:* If#= 1 Alt= 0 #EPs= 2 Cls=08(stor.) Sub=06 Prot=50 Driver=usb-storage
E:  Ad=82(I) Atr=02(Bulk) MxPS= 512 Ivl=0ms
E:  Ad=02(O) Atr=02(Bulk) MxPS= 512 Ivl=0ms
I:* If#= 2 Alt= 0 #EPs= 2 Cls=08(stor.) Sub=06 Prot=50 Driver=usb-storage
E:  Ad=83(I) Atr=02(Bulk) MxPS= 512 Ivl=0ms
E:  Ad=03(O) Atr=02(Bulk) MxPS= 512 Ivl=0ms

T:  Bus=01 Lev=01 Prnt=01 Port=04 Cnt=02 Dev#=  3 Spd=480  MxCh= 4
D:  Ver= 2.00 Cls=09(hub  ) Sub=00 Prot=02 MxPS=64 #Cfgs=  1
P:  Vendor=04b4 ProdID=6560 Rev= 0.0b
C:* #Ifs= 1 Cfg#= 1 Atr=e0 MxPwr=100mA
I:  If#= 0 Alt= 0 #EPs= 1 Cls=09(hub  ) Sub=00 Prot=01 Driver=hub
E:  Ad=81(I) Atr=03(Int.) MxPS=   1 Ivl=256ms
I:* If#= 0 Alt= 1 #EPs= 1 Cls=09(hub  ) Sub=00 Prot=02 Driver=hub
E:  Ad=81(I) Atr=03(Int.) MxPS=   1 Ivl=256ms
