
T:  Bus=08 Lev=00 Prnt=00 Port=00 Cnt=00 Dev#=  1 Spd=12   MxCh= 2
B:  Alloc=  0/900 us ( 0%), #Int=  0, #Iso=  0
D:  Ver= 1.10 Cls=09(hub  ) Sub=00 Prot=00 MxPS=64 #Cfgs=  1
P:  Vendor=1d6b ProdID=0001 Rev= 3.17
S:  Manufacturer=Linux 3.17.3-200.fc20.x86_64 uhci_hcd
S:  Product=UHCI Host Controller
S:  SerialNumber=0000:00:1d.2
C:* #Ifs= 1 Cfg#= 1 Atr=e0 MxPwr=  0mA
I:* If#= 0 Alt= 0 #EPs= 1 Cls=09(hub  ) Sub=00 Prot=00 Driver=hub
E:  Ad=81(I) Atr=03(Int.) MxPS=   2 Ivl=255ms

T:  Bus=07 Lev=00 Prnt=00 Port=00 Cnt=00 Dev#=  1 Spd=12   MxCh= 2
B:  Alloc=  0/900 us ( 0%), #Int=  0, #Iso=  0
D:  Ver= 1.10 Cls=09(hub  ) Sub=00 Prot=00 MxPS=64 #Cfgs=  1
P:  Vendor=1d6b ProdID=0001 Rev= 3.17
S:  Manufacturer=Linux 3.17.3-200.fc20.x86_64 uhci_hcd
S:  Product=UHCI Host Controller
S:  SerialNumber=0000:00:1d.1
C:* #Ifs= 1 Cfg#= 1 Atr=e0 MxPwr=  0mA
I:* If#= 0 Alt= 0 #EPs= 1 Cls=09(hub  ) Sub=00 Prot=00 Driver=hub
E:  Ad=81(I) Atr=03(Int.) MxPS=   2 Ivl=255ms

T:  Bus=06 Lev=00 Prnt=00 Port=00 Cnt=00 Dev#=  1 Spd=12   MxCh= 2
B:  Alloc=  0/900 us ( 0%), #Int=  0, #Iso=  0
D:  Ver= 1.10 Cls=09(hub  ) Sub=00 Prot=00 MxPS=64 #Cfgs=  1
P:  Vendor=1d6b ProdID=0001 Rev= 3.17
S:  Manufacturer=Linux 3.17.3-200.fc20.x86_64 uhci_hcd
S:  Product=UHCI Host Controller
S:  SerialNumber=0000:00:1d.0
C:* #Ifs= 1 Cfg#= 1 Atr=e0 MxPwr=  0mA
I:* If#= 0 Alt= 0 #EPs= 1 Cls=09(hub  ) Sub=00 Prot=00 Driver=hub
E:  Ad=81(I) Atr=03(Int.) MxPS=   2 Ivl=255ms

T:  Bus=05 Lev=00 Prnt=00 Port=00 Cnt=00 Dev#=  1 Spd=12   MxCh= 2
B:  Alloc=  0/900 us ( 0%), #Int=  0, #Iso=  0
D:  Ver= 1.10 Cls=09(hub  ) Sub=00 Prot=00 MxPS=64 #Cfgs=  1
P:  Vendor=1d6b ProdID=0001 Rev= 3.17
S:  Manufacturer=Linux 3.17.3-200.fc20.x86_64 uhci_hcd
S:  Product=UHCI Host Controller
S:  SerialNumber=0000:00:1a.2
C:* #Ifs= 1 Cfg#= 1 Atr=e0 MxPwr=  0mA
I:* If#= 0 Alt= 0 #EPs= 1 Cls=09(hub  ) Sub=00 Prot=00 Driver=hub
E:  Ad=81(I) Atr=03(Int.) MxPS=   2 Ivl=255ms

T:  Bus=04 Lev=00 Prnt=00 Port=00 Cnt=00 Dev#=  1 Spd=12   MxCh= 2
B:  Alloc=  0/900 us ( 0%), #Int=  0, #Iso=  0
D:  Ver= 1.10 Cls=09(hub  ) Sub=00 Prot=00 MxPS=64 #Cfgs=  1
P:  Vendor=1d6b ProdID=0001 Rev= 3.17
S:  Manufacturer=Linux 3.17.3-200.fc20.x86_64 uhci_hcd
S:  Product=UHCI Host Controller
S:  SerialNumber=0000:00:1a.1
C:* #Ifs= 1 Cfg#= 1 Atr=e0 MxPwr=  0mA
I:* If#= 0 Alt= 0 #EPs= 1 Cls=09(hub  ) Sub=00 Prot=00 Driver=hub
E:  Ad=81(I) Atr=03(Int.) MxPS=   2 Ivl=255ms

T:  Bus=03 Lev=00 Prnt=00 Port=00 Cnt=00 Dev#=  1 Spd=12   MxCh= 2
B:  Alloc=  0/900 us ( 0%), #Int=  0, #Iso=  0
D:  Ver= 1.10 Cls=09(hub  ) Sub=00 Prot=00 MxPS=64 #Cfgs=  1
P:  Vendor=1d6b ProdID=0001 Rev= 3.17
S:  Manufacturer=Linux 3.17.3-200.fc20.x86_64 uhci_hcd
S:  Product=UHCI Host Controller
S:  SerialNumber=0000:00:1a.0
C:* #Ifs= 1 Cfg#= 1 Atr=e0 MxPwr=  0mA
I:* If#= 0 Alt= 0 #EPs= 1 Cls=09(hub  ) Sub=00 Prot=00 Driver=hub
E:  Ad=81(I) Atr=03(Int.) MxPS=   2 Ivl=255ms

T:  Bus=02 Lev=00 Prnt=00 Port=00 Cnt=00 Dev#=  1 Spd=480  MxCh= 6
B:  Alloc=  8/800 us ( 1%), #Int=  4, #Iso=  0
D:  Ver= 2.00 Cls=09(hub  ) Sub=00 Prot=00 MxPS=64 #Cfgs=  1
P:  Vendor=1d6b ProdID=0002 Rev= 3.17
S:  Manufacturer=Linux 3.17.3-200.fc20.x86_64 ehci_hcd
S:  Product=EHCI Host Controller
S:  SerialNumber=0000:00:1d.7
C:* #Ifs= 1 Cfg#= 1 Atr=e0 MxPwr=  0mA
I:* If#= 0 Alt= 0 #EPs= 1 Cls=09(hub  ) Sub=00 Prot=00 Driver=hub
E:  Ad=81(I) Atr=03(Int.) MxPS=   4 Ivl=256ms

T:  Bus=02 Lev=01 Prnt=01 Port=00 Cnt=01 Dev#=  2 Spd=480  MxCh= 2
D:  Ver= 2.00 Cls=09(hub  ) Sub=00 Prot=02 MxPS=64 #Cfgs=  1
P:  Vendor=0424 ProdID=2514 Rev= 0.00
C:* #Ifs= 1 Cfg#= 1 Atr=e0 MxPwr=  2mA
I:  If#= 0 Alt= 0 #EPs= 1 Cls=09(hub  ) Sub=00 Prot=01 Driver=hub
E:  Ad=81(I) Atr=03(Int.) MxPS=   1 Ivl=256ms
I:* If#= 0 Alt= 1 #EPs= 1 Cls=09(hub  ) Sub=00 Prot=02 Driver=hub
E:  Ad=81(I) Atr=03(Int.) MxPS=   1 Ivl=256ms

T:  Bus=02 Lev=02 Prnt=02 Port=00 Cnt=01 Dev#=  3 Spd=1.5  MxCh= 0
D:  Ver= 2.00 Cls=00(>ifc ) Sub=00 Prot=00 MxPS= 8 #Cfgs=  1
P:  Vendor=046d ProdID=c069 Rev=56.01
S:  Manufacturer=Logitech
S:  Product=USB Laser Mouse
C:* #Ifs= 1 Cfg#= 1 Atr=a0 MxPwr= 98mA
I:* If#= 0 Alt= 0 #EPs= 1 Cls=03(HID  ) Sub=01 Prot=02 Driver=usbhid
E:  Ad=81(I) Atr=03(Int.) MxPS=   6 Ivl=10ms

T:  Bus=02 Lev=02 Prnt=02 Port=01 Cnt=02 Dev#=  4 Spd=1.5  MxCh= 0
D:  Ver= 1.10 Cls=00(>ifc ) Sub=00 Prot=00 MxPS= 8 #Cfgs=  1
P:  Vendor=04d9 ProdID=1818 Rev= 1.01
S:  Product=USB Keyboard
C:* #Ifs= 2 Cfg#= 1 Atr=a0 MxPwr=100mA
I:* If#= 0 Alt= 0 #EPs= 1 Cls=03(HID  ) Sub=01 Prot=01 Driver=usbhid
E:  Ad=81(I) Atr=03(Int.) MxPS=   8 Ivl=1ms
I:* If#= 1 Alt= 0 #EPs= 1 Cls=03(HID  ) Sub=01 Prot=02 Driver=usbhid
E:  Ad=82(I) Atr=03(Int.) MxPS=   8 Ivl=1ms

T:  Bus=01 Lev=00 Prnt=00 Port=00 Cnt=00 Dev#=  1 Spd=480  MxCh= 6
B:  Alloc=  0/800 us ( 0%), #Int=  0, #Iso=  0
D:  Ver= 2.00 Cls=09(hub  ) Sub=00 Prot=00 MxPS=64 #Cfgs=  1
P:  Vendor=1d6b ProdID=0002 Rev= 3.17
S:  Manufacturer=Linux 3.17.3-200.fc20.x86_64 ehci_hcd
S:  Product=EHCI Host Controller
S:  SerialNumber=0000:00:1a.7
C:* #Ifs= 1 Cfg#= 1 Atr=e0 MxPwr=  0mA
I:* If#= 0 Alt= 0 #EPs= 1 Cls=09(hub  ) Sub=00 Prot=00 Driver=hub
E:  Ad=81(I) Atr=03(Int.) MxPS=   4 Ivl=256ms
