
T:  Bus=03 Lev=00 Prnt=00 Port=00 Cnt=00 Dev#=  1 Spd=12  MxCh= 2
B:  Alloc=  0/900 us ( 0%), #Int=  0, #Iso=  0
D:  Ver= 1.10 Cls=09(hub  ) Sub=00 Prot=00 MxPS=64 #Cfgs=  1
P:  Vendor=0000 ProdID=0000 Rev= 2.06
S:  Manufacturer=Linux 2.6.18-398.el5 ohci_hcd
S:  Product=OHCI Host Controller
S:  SerialNumber=0000:00:01.1
C:* #Ifs= 1 Cfg#= 1 Atr=e0 MxPwr=  0mA
I:  If#= 0 Alt= 0 #EPs= 1 Cls=09(hub  ) Sub=00 Prot=00 Driver=hub
E:  Ad=81(I) Atr=03(Int.) MxPS=   2 Ivl=255ms

T:  Bus=02 Lev=00 Prnt=00 Port=00 Cnt=00 Dev#=  1 Spd=12  MxCh= 3
B:  Alloc=  0/900 us ( 0%), #Int=  0, #Iso=  0
D:  Ver= 1.10 Cls=09(hub  ) Sub=00 Prot=00 MxPS=64 #Cfgs=  1
P:  Vendor=0000 ProdID=0000 Rev= 2.06
S:  Manufacturer=Linux 2.6.18-398.el5 ohci_hcd
S:  Product=OHCI Host Controller
S:  SerialNumber=0000:00:01.0
C:* #Ifs= 1 Cfg#= 1 Atr=e0 MxPwr=  0mA
I:  If#= 0 Alt= 0 #EPs= 1 Cls=09(hub  ) Sub=00 Prot=00 Driver=hub
E:  Ad=81(I) Atr=03(Int.) MxPS=   2 Ivl=255ms

T:  Bus=01 Lev=00 Prnt=00 Port=00 Cnt=00 Dev#=  1 Spd=480 MxCh= 5
B:  Alloc=  0/800 us ( 0%), #Int=  0, #Iso=  0
D:  Ver= 2.00 Cls=09(hub  ) Sub=00 Prot=01 MxPS=64 #Cfgs=  1
P:  Vendor=0000 ProdID=0000 Rev= 2.06
S:  Manufacturer=Linux 2.6.18-398.el5 ehci_hcd
S:  Product=EHCI Host Controller
S:  SerialNumber=0000:00:01.2
C:* #Ifs= 1 Cfg#= 1 Atr=e0 MxPwr=  0mA
I:  If#= 0 Alt= 0 #EPs= 1 Cls=09(hub  ) Sub=00 Prot=00 Driver=hub
E:  Ad=81(I) Atr=03(Int.) MxPS=   2 Ivl=256ms
